uri,dc.identifier,collections,notation,prefLabel,altLabel,broader,broaderTransitive,broadMatch,changeNote,closeMatch,definition,editorialNote,exactMatch,example,hiddenLabel,historyNote,inScheme,mappingRelation,note,related,relatedMatch,scopeNote,semanticRelation,topConceptOf
conceptscheme:bekistingsmateriaal,be.vlaanderen.bodemenondergrond.data.id.conceptscheme.bekistingsmateriaal,,bekistingsmaterialen,Conceptschema bekistingsmaterialen.,,,,,,,"Het materiaal dat in het boorgat achterblijft als al dan niet verloren bekisting.",,,,,,,,,,,,,
collectie:bekistingsmaterialen,be.vlaanderen.bodemenondergrond.data.id.collection.bekistingsmateriaal.bekistingsmaterialen,,collectie_bekistingsmaterialen,Collectie bekistingsmaterialen.,,,,,,,"Lijst van materialen die gebruikt worden voor de afwerking van het boorgat of materialen die na de uitvoering van de boring in het boorgat achterblijven.",,,,,,conceptscheme:bekistingsmateriaal,,,,,,,
concept:natuurlijk,be.vlaanderen.bodemenondergrond.data.id.concept.bekistingsmateriaal.natuurlijk,collectie:bekistingsmaterialen,natuurlijk,"natuurlijke materialen (biodegradeerbaar, hout, …)",,,,,,,"Het boorgat is afgewerkt met natuurlijke materialen zoals bijvoorbeeld biologisch afbreekbare stoffen, hout.",,,,,,conceptscheme:bekistingsmateriaal,,,,,,,conceptscheme:bekistingsmateriaal
concept:kunststofPVC,be.vlaanderen.bodemenondergrond.data.id.concept.bekistingsmateriaal.kunststofPVC,collectie:bekistingsmaterialen,kunststofPVC,"kunststof: PVC",,,,,,,"De materialen die in het boorgat achterblijven als al dan niet verloren bekisting of buizen bestaan uit PVC.",,,,,,conceptscheme:bekistingsmateriaal,,,,,,,conceptscheme:bekistingsmateriaal
concept:kunststofander,be.vlaanderen.bodemenondergrond.data.id.concept.bekistingsmateriaal.kunststofander,collectie:bekistingsmaterialen,kunststofander,"kunststof: andere (PE, HDPE, LDPE, …)",,,,,,,"De materialen die in het boorgat achterblijven als al dan niet verloren bekisting of buizen bestaan uit kunststof anders dan PVC zoals polyethylene (PE, HDPE, LDPE, …).",,,,,,conceptscheme:bekistingsmateriaal,,,,,,,conceptscheme:bekistingsmateriaal
concept:metaal,be.vlaanderen.bodemenondergrond.data.id.concept.bekistingsmateriaal.metaal,collectie:bekistingsmaterialen,metaal,"metaal: inox, staal, roestvrij staal, gegalvaniseerd staal, …",,,,,,,"De materialen die in het boorgat achterblijven als al dan niet verloren bekisting of buizen bestaan uit metaal zoals inox of staal.",,,,,,conceptscheme:bekistingsmateriaal,,,,,,,conceptscheme:bekistingsmateriaal
concept:steen,be.vlaanderen.bodemenondergrond.data.id.concept.bekistingsmateriaal.steen,collectie:bekistingsmaterialen,steen,"beton/metselwerk",,,,,,,"Het boorgat is afgewerkt met bekisting uit beton of metselwerk.",,,,,,conceptscheme:bekistingsmateriaal,,,,,,,conceptscheme:bekistingsmateriaal
