id,type,dc\.identifier,inScheme,member,notation,prefLabel,definition,note,topConceptOf,hasTopConcept
https://data.bodemenondergrond.vlaanderen.be/id/collection/bekistingsmateriaal/bekistingsmaterialen,http://www.w3.org/2004/02/skos/core#Collection,be.vlaanderen.bodemenondergrond.data.id.collection.bekistingsmateriaal.bekistingsmaterialen,https://data.bodemenondergrond.vlaanderen.be/id/conceptscheme/bekistingsmateriaal,https://data.bodemenondergrond.vlaanderen.be/id/concept/bekistingsmateriaal/kunststofPVC|https://data.bodemenondergrond.vlaanderen.be/id/concept/bekistingsmateriaal/kunststofander|https://data.bodemenondergrond.vlaanderen.be/id/concept/bekistingsmateriaal/metaal|https://data.bodemenondergrond.vlaanderen.be/id/concept/bekistingsmateriaal/natuurlijk|https://data.bodemenondergrond.vlaanderen.be/id/concept/bekistingsmateriaal/steen,collectie_bekistingsmaterialen,Collectie van bekistingsmaterialen.,null,null,null,null
https://data.bodemenondergrond.vlaanderen.be/id/concept/bekistingsmateriaal/kunststofPVC,http://www.w3.org/2004/02/skos/core#Concept,be.vlaanderen.bodemenondergrond.data.id.concept.bekistingsmateriaal.kunststofPVC,https://data.bodemenondergrond.vlaanderen.be/id/conceptscheme/bekistingsmateriaal,null,kunststofPVC,kunststof: PVC,De materialen die in het boorgat achterblijven als al dan niet verloren bekisting of buizen bestaan uit PVC.,De materialen die in het boorgat achterblijven als al dan niet verloren bekisting of buizen bestaan uit PVC.,https://data.bodemenondergrond.vlaanderen.be/id/conceptscheme/bekistingsmateriaal,null
https://data.bodemenondergrond.vlaanderen.be/id/concept/bekistingsmateriaal/kunststofander,http://www.w3.org/2004/02/skos/core#Concept,be.vlaanderen.bodemenondergrond.data.id.concept.bekistingsmateriaal.kunststofander,https://data.bodemenondergrond.vlaanderen.be/id/conceptscheme/bekistingsmateriaal,null,kunststofander,"kunststof: andere (PE, HDPE, LDPE, …)","De materialen die in het boorgat achterblijven als al dan niet verloren bekisting of buizen bestaan uit kunststof anders dan PVC zoals polyethylene (PE, HDPE, LDPE, …).","De materialen die in het boorgat achterblijven als al dan niet verloren bekisting of buizen bestaan uit kunststof anders dan PVC zoals polyethylene (PE, HDPE, LDPE, …).",https://data.bodemenondergrond.vlaanderen.be/id/conceptscheme/bekistingsmateriaal,null
https://data.bodemenondergrond.vlaanderen.be/id/concept/bekistingsmateriaal/metaal,http://www.w3.org/2004/02/skos/core#Concept,be.vlaanderen.bodemenondergrond.data.id.concept.bekistingsmateriaal.metaal,https://data.bodemenondergrond.vlaanderen.be/id/conceptscheme/bekistingsmateriaal,null,metaal,"metaal: inox, staal, roestvrij staal, gegalvaniseerd staal, …",De materialen die in het boorgat achterblijven als al dan niet verloren bekisting of buizen bestaan uit metaal zoals inox of staal.,De materialen die in het boorgat achterblijven als al dan niet verloren bekisting of buizen bestaan uit metaal zoals inox of staal.,https://data.bodemenondergrond.vlaanderen.be/id/conceptscheme/bekistingsmateriaal,null
https://data.bodemenondergrond.vlaanderen.be/id/concept/bekistingsmateriaal/natuurlijk,http://www.w3.org/2004/02/skos/core#Concept,be.vlaanderen.bodemenondergrond.data.id.concept.bekistingsmateriaal.natuurlijk,https://data.bodemenondergrond.vlaanderen.be/id/conceptscheme/bekistingsmateriaal,null,natuurlijk,"natuurlijke materialen (biodegradeerbaar, hout, …)","Het boorgat is afgewerkt met natuurlijke materialen zoals bijvoorbeeld biologisch afbreekbare stoffen, hout.","Het boorgat is afgewerkt met natuurlijke materialen zoals bijvoorbeeld biologisch afbreekbare stoffen, hout.",https://data.bodemenondergrond.vlaanderen.be/id/conceptscheme/bekistingsmateriaal,null
https://data.bodemenondergrond.vlaanderen.be/id/concept/bekistingsmateriaal/steen,http://www.w3.org/2004/02/skos/core#Concept,be.vlaanderen.bodemenondergrond.data.id.concept.bekistingsmateriaal.steen,https://data.bodemenondergrond.vlaanderen.be/id/conceptscheme/bekistingsmateriaal,null,steen,beton/metselwerk,Het boorgat is afgewerkt met bekisting uit beton of metselwerk.,Het boorgat is afgewerkt met bekisting uit beton of metselwerk.,https://data.bodemenondergrond.vlaanderen.be/id/conceptscheme/bekistingsmateriaal,null
https://data.bodemenondergrond.vlaanderen.be/id/conceptscheme/bekistingsmateriaal,http://www.w3.org/2004/02/skos/core#ConceptScheme,be.vlaanderen.bodemenondergrond.data.id.conceptscheme.bekistingsmateriaal,null,null,bekistingsmaterialen,Conceptschema van bekistingsmaterialen.,null,null,null,https://data.bodemenondergrond.vlaanderen.be/id/concept/bekistingsmateriaal/kunststofPVC|https://data.bodemenondergrond.vlaanderen.be/id/concept/bekistingsmateriaal/kunststofander|https://data.bodemenondergrond.vlaanderen.be/id/concept/bekistingsmateriaal/metaal|https://data.bodemenondergrond.vlaanderen.be/id/concept/bekistingsmateriaal/natuurlijk|https://data.bodemenondergrond.vlaanderen.be/id/concept/bekistingsmateriaal/steen